beruf,isco_code,beschaeftigte_1000,frauen_pct,branche,lohn_median_chf,qualifikation,esco_uri,esco_titel,esco_beschreibung,beschreibung_quelle
Dipl. Pflegefachperson,2221,130.0,84.0,Gesundheit,82000,Tertiär,http://data.europa.eu/esco/occupation/1fb92021-9576-4c85-8759-f6918e9f0ad4,Diplomat/Diplomatin,Diplomaten/Diplomatinnen vertreten ihr Land und dessen Regierung gegenüber internationalen Organisationen. Sie verhandeln mit den Beamten/Beamtinnen der Einrichtung über die Wahrung der Interessen ihres Herkunftslands und fördern den produktiven und freundlichen Austausch zwischen dem Herkunftsland und der internationalen Organisation.,ESCO
Kaufmann/-frau EFZ (allg. Richtung),4110,110.0,58.0,Verwaltung,72000,Sekundär II,http://data.europa.eu/esco/occupation/6a163fef-dee8-4583-82b0-13b76d8a27b2,Fachverkäufer für Kraftfahrzeuge/Fachverkäuferin für Kraftfahrzeuge,"Fachverkäufer für Kraftfahrzeuge verkaufen in Fachgeschäften Autos und Kraftfahrzeuge. 
 
 ",ESCO
Softwareentwickler/in,2512,95.0,16.0,ICT,130000,Tertiär,http://data.europa.eu/esco/occupation/f2b15a0e-e65a-438a-affb-29b9d50b77d1,Softwareentwickler/Softwareentwicklerin,"Softwareentwickler implementieren oder programmieren Softwaresystemen jeder Art auf der Grundlage von Spezifikationen bzw. Entwürfen unter Einsatz von Programmiersprachen, Tools und Plattformen.",ESCO
Fachperson Gesundheit EFZ (FaGe),3221,80.0,88.0,Gesundheit,62000,Sekundär II,http://data.europa.eu/esco/occupation/5a9acd29-666c-4ca1-b10e-e086584a526b,Sozialbetreuer psychische Gesundheit/Sozialbetreuerin psychische Gesundheit,"Sozialbetreuer psychische Gesundheit helfen Menschen, die psychische oder emotionale Probleme haben oder von Drogenmissbrauch betroffen sind. Sie betreuen ihre Kunden individuell und überwachen deren Genesungsprozess. Dabei sorgen sie auch für Therapien, Krisenintervention, Beratung und Aufklärung.",ESCO
Detailhandelsfachmann/-frau EFZ,5223,70.0,65.0,Detailhandel,58000,Sekundär II,http://data.europa.eu/esco/occupation/6ba25e0f-7fb8-4879-a1f9-d4f8945966be,Kameramann/Kamerafrau,"Kameramänner/ Kamerafrauen sind für die visuelle Interpretation des Drehbuchs und sämtliche fotografische Aspekte des Films verantwortlich, einschließlich Bildeinstellungen, Farben, Licht, Stil und Drehorte. Sie geben dem Film bzw. der Fernsehsendung ein optisches Erscheinungsbild und wählen die Drehausrüstung aus, einschließlich der Objektive und Filter. Bildgestaltende Kameramänner/-frauen leiten die Teams an, die die optischen Geräte und die Beleuchtung bedienen. Um die gewünschte Wirkung zu erzielen, arbeiten sie mit dem Film- und Fernsehregisseur/der Film- und Fernsehregisseurin zusammen.",ESCO
Führungskräfte in Vertrieb und Marketing,1221,55.2,36.5,Verwaltung,120000,Tertiär,http://data.europa.eu/esco/occupation/a7594892-ff23-4e2a-aedf-2f967ebca15c,Führungskraft im Vertrieb,"Führungskräfte im Vertrieb entwickeln Absatz- und Zielstrategien für ein Unternehmen. Sie leiten Verkaufsteams, weisen auf der Grundlage der Pläne Absatzressourcen zu, priorisieren und verfolgen wichtige Interessentinnen und Interessenten („Leads“), entwickeln und verfeinern Verkaufsargumente und unterhalten eine Verkaufsplattform, um sämtliche Interessentinnen und Interessenten und Verkäufe zu verfolgen.",ESCO
Primarlehrer/in,2341,55.0,72.0,Bildung,102000,Tertiär,http://data.europa.eu/esco/occupation/03d79393-7b30-4159-945b-01963eddd302,Lehrkraft im Primarbereich,"Lehrkräfte im Primarbereich unterrichten Schülerinnen und Schüler der Grundschulstufe. Sie erstellen Unterrichtspläne im Einklang mit den Lehrplanzielen für die von ihnen unterrichteten Fächer, einschließlich Rechnen, Sprachen, Naturkunde und Musik. Sie überwachen die Lernentwicklung der Schülerinnen und Schüler und bewerten ihre Kenntnisse und Fähigkeiten in den Unterrichtsfächern anhand von Tests. Sie richten den Unterrichtsinhalt an den Vorkenntnissen der Schülerinnen und Schüler aus und ermutigen sie, ihr Verständnis in Bezug auf ihre Interessensgebiete zu vertiefen. Sie verwenden Unterrichtsmaterialien und -methoden, um ein inspirierendes Lernumfeld zu schaffen. Lehrkräfte im Primarbereich tragen zudem zu Schulveranstaltungen bei und tauschen sich mit den Erziehungsberechtigten und der Schulleitung aus.",ESCO
Bankkaufmann/-frau,3311,55.0,45.0,Finanzen,92000,Sekundär II,http://data.europa.eu/esco/occupation/2ff9e53c-6e7f-42af-8d71-b5dd7f283089,Bankbediensteter/Bankbedienstete,"Bankbedienstete haben zumeist Kontakt zu Bankkunden. Sie werben für die Produkte und Dienstleistungen der Bank und stellen Informationen über die persönlichen Konten der Kunden und die damit verbundenen Überweisungen, Einlagen, Spareinlagen usw. bereit. Sie bestellen Bankkarten und Schecks für die Kunden, nehmen Barmittel und Schecks entgegen und verrechnen sie und sorgen für die Einhaltung interner Richtlinien. Sie bearbeiten die Kundenkonten, wickeln Zahlungen ab und verwalten die Verwendung von Tresoren und Schließfächern.",ESCO
Soziale Fachkräfte,3412,50.7,66.4,Soziales,72000,Sekundär II,http://data.europa.eu/esco/occupation/c18fddf5-cfc4-4f9c-94d6-86608faaa1dd,Manager im Bereich soziale Dienste/Managerin im Bereich soziale Dienste,"Manager im Bereich soziale Dienste/Managerinnen im Bereich soziale Dienste sind für die strategische und operative Leitung und die Personal- und Ressourcenverwaltung in Bezug auf soziale Dienste verantwortlich. Sie sind für die Umsetzung von Rechtsvorschriften und Strategien zuständig, beispielsweise in Bezug auf schutzbedürftige Personen.  Sie fördern soziale Arbeit und soziale Fürsorge sowie Ethik, Gleichheit, Vielfalt und einschlägige Verhaltenskodizes für die Praxis. Sie sind für die Zusammenarbeit mit anderen Fachkräften in den Bereichen Strafjustiz, Bildung und Gesundheit zuständig. Sie können dafür verantwortlich sein, einen Beitrag zur Entwicklung der regionalen bzw. staatlichen Politik zu leisten.",ESCO
Reinigungskraft / Hauswart,9112,50.0,72.0,Dienstleistungen,46000,Keine Ausbildung,http://data.europa.eu/esco/occupation/731ecac4-06e8-4ec2-a559-101fecbd9183,Raumpfleger/Raumpflegerin,"Raumpfleger reinigen Gästezimmer und andere öffentliche Bereiche, räumen sie auf und füllen Vorräte auf.",ESCO
Köche,5120,48.9,34.6,Gastgewerbe,52000,Sekundär II,http://data.europa.eu/esco/occupation/90f75f67-495d-49fa-ab57-2f320e251d7e,Koch/Köchin,"Köche sind in Küchen tätig und dafür qualifiziert, Lebensmittel – in der Regel in einem Privathaushalt, einer Institution oder einem Unternehmen – zuzubereiten und anzurichten.",ESCO
Landwirte mit Ackerbau und Tierhaltung (ohne ausgeprägten Schwerpunkt),6130,46.6,19.9,Landwirtschaft,52000,Sekundär II,http://data.europa.eu/esco/occupation/1c1e86f9-6347-42d6-aa6e-c95b138bf640,Landwirt/Landwirtin,Landwirte betreiben kleine Unternehmen oder sind Selbstversorger. Sie kümmern sich um alle Aspekte der Viehhaltung und des Pflanzenanbaus.,ESCO
Sekretär/in / Assistent/in,4120,45.0,88.0,Verwaltung,70000,Sekundär II,http://data.europa.eu/esco/occupation/5ac377d2-e1d0-4911-a299-b4ef2782a0ba,Sekretär/Sekretärin,"Sekretariatskräfte nehmen eine Vielzahl administrativer Aufgaben wahr, um reibungslose Abläufe innerhalb einer Organisation zu gewährleisten. Sie nehmen Telefonanrufe entgegen, verfassen und versenden E-Mails, führen Terminkalender, vereinbaren Treffen, nehmen Mitteilungen entgegen, archivieren Dokumente, organisieren und betreuen Sitzungen und verwalten Datenbanken.",ESCO
Hauswarte,5153,44.3,29.0,Gastgewerbe,52000,Sekundär II,http://data.europa.eu/esco/occupation/1822bfc2-e735-449f-ba00-ca71eb5c062b,Hauswart/Hauswartin,"Hauswarte halten Gebäude instand und überwachen ihren Zustand und ihre Sicherheit. Sie führen Reinigungsarbeiten aus, nehmen kleinere Reparaturen vor und sorgen dafür, dass den Bewohnern Heizung, Warmwasser und andere Versorgungseinrichtungen zur Verfügung stehen. Hausmeister sind für die Qualität der Gebäude verantwortlich und dienen auch als Ansprechpartner für die Bewohner.",ESCO
Fachkräfte in Marketing und Werbung,2431,43.9,50.5,Finanzen,115000,Tertiär,http://data.europa.eu/esco/occupation/4795d4e3-c623-47ff-abab-7de97fcb764e,Mediakäufer/Mediakäuferin,"Mediakäufer erwerben im Namen ihrer Kunden Werbeflächen bzw. -zeiten in Print-, Rundfunk- und Online-Medien. Sie analysieren die Wirksamkeit und Angemessenheit der verschiedenen Kanäle in Abhängigkeit von der Ware oder Dienstleistung, um eine Grundlage für die Entscheidungsfindung zu erhalten. Sie bemühen sich, einen möglichst günstigen Preis auszuhandeln, ohne die Qualität der Werbung zu beeinträchtigen. Sie unterstützen die Entwicklung und Umsetzung von Marketing- und Werbeplänen im Kommunikationsbereich, indem sie das geeignetste Medium auswählen.",ESCO
Verkäufer/in (ohne Ausbildung),5223,40.0,70.0,Detailhandel,50000,Sekundär II,http://data.europa.eu/esco/occupation/9ba74e8a-c40c-4228-9998-eb3c7a5c11df,Verkäufer/Verkäuferin,Verkäufer stehen in direktem Kontakt mit den Kunden. Sie bieten den Kunden allgemeine Beratung.,ESCO
Sachbearbeiter/in öff. Verwaltung,4416,40.0,58.0,Öff. Verwaltung,82000,Sekundär II,http://data.europa.eu/esco/occupation/d8ed1703-9c03-4ea0-83cc-b6169bc54ffd,Personalsachbearbeiter/Personalsachbearbeiterin,"Personalsachbearbeiter unterstützen Personalmanager bei allen Prozessen und Tätigkeiten. Sie helfen bei der Vorbereitung von Einstellungsverfahren, indem sie die eingegangenen Lebensläufe scannen und die Auswahl auf die am besten geeigneten Kandidaten beschränken. Sie erledigen Verwaltungsaufgaben, bereiten Mitteilungen und Schreiben vor und führen die Auswertung der Erhebungen und Bewertungen durch die Abteilung durch.",ESCO
Schalterbedienstete und Fachkräfte im Bereich Finanzdienstleistungen,4211,39.8,48.8,Verwaltung,68000,Sekundär II,http://data.europa.eu/esco/occupation/65bd2342-f7de-4932-9164-eb480e35a791,Fachkraft für Nutztierhaltung,"Fachkräfte für Nutztierhaltung bewahren die Gesundheit und das Wohlergehen von Tieren. Sie überwachen die Zucht/Produktion und die tägliche Pflege, z. B. die Fütterung und das Tränken von Tieren.",ESCO
Sekundarlehrer/in,2330,38.0,55.0,Bildung,110000,Tertiär,http://data.europa.eu/esco/occupation/5efb2c08-ba3a-4659-a2e4-1883f54e77b6,secondary school teacher,"Lehrkräfte Sekundarstufe unterrichten Schülerinnen und Schüler, in der Regel Kinder und junge Erwachsene, in einer Schule des Sekundarbereichs. Sie sind in der Regel Fachlehrkräfte, die in dem Fach ihrer Spezialisierung unterrichten. Sie erstellen Unterrichtspläne und -materialien, beobachten die Fortschritte der Schülerinnen und Schüler, bieten bei Bedarf ihre individuelle Hilfestellung und bewerten die Kenntnisse der Schülerinnen und Schüler anhand von Aufgaben, Tests und Prüfungen.",ESCO
Fachkräfte im Rechnungswesen,3313,36.2,58.7,Finanzen,82000,Sekundär II,http://data.europa.eu/esco/occupation/eda0d957-3c3c-4139-b89a-a18bc9e18897,Controller/Controllerin,"Controller/Controllerinnen prüfen und analysieren Jahresabschlüsse, Budgets, Finanzberichte und Geschäftspläne auf fehlerbedingte oder betrügerische Unregelmäßigkeiten und beraten ihre Kunden zu Themen wie Finanzprognose und Risikoanalyse.  Sie können Finanzdaten prüfen, Insolvenzfälle verwalten, Steuererklärungen erstellen und in Bezug auf die geltenden Rechtsvorschriften weitere Steuerberatung anbieten.",ESCO
Fachärzte,2212,36.0,46.6,Gesundheit,90000,Tertiär,http://data.europa.eu/esco/occupation/9b889f07-c39c-464d-b9d9-b2daa650f9ac,Facharzt/Fachärztin,Fachärzte/Fachärztinnen beugen Krankheiten vor und diagnostizieren und behandeln Krankheiten entsprechend ihrer medizinischen oder chirurgischen Spezialisierung.,ESCO
Sekretariatsfachkräfte in Verwaltung und Geschäftsleitung,3343,35.1,81.4,Finanzen,82000,Sekundär II,http://data.europa.eu/esco/occupation/2a04a1df-a3b9-403e-a245-e7f93fdddd44,Vorstandsassistent/Vorstandsassistentin,"Vorstandsassistenten sind hochrangige Verwaltungsfachkräfte, die in verschiedenen Branchen für Führungskräften oder in internationalen Einrichtungen arbeiten. Sie organisieren Sitzungen, ordnen und pflegen Akten, buchen Reisen, schulen Mitarbeiter, erledigen fremdsprachige Korrespondenz bzw. Kommunikation und leiten den täglichen Bürobetrieb.",ESCO
Pflegeassistent/in,5321,35.0,87.0,Gesundheit,55000,Sekundär II,http://data.europa.eu/esco/occupation/d38c2107-98f2-47b7-8bb4-f69750d51082,Pflegehelfer/Pflegehelferin,Pflegehelfer arbeiten im Team mit registrierten Krankenschwestern/Krankenpflegern in der Krankenpflege sowie der Pflege und Versorgung von Patienten aller Altersgruppen in allen Bereichen der Akut- und Erstversorgung.,ESCO
Geschäftsführer/in (KMU),1120,35.0,22.0,Verwaltung,160000,Tertiär,http://data.europa.eu/esco/occupation/4be4ea31-1211-4f0c-82bb-f6fe10791f4d,Geschäftsführer eines Flughafens/Geschäftsführerin eines Flughafens,"Geschäftsführer/Geschäftsführerinnen von Flughäfen leiten eine Gruppe von Flughafendirektoren/Flughafendirektorinnen, die für alle Bereiche des Flughafens zuständig sind. Sie planen die strategische Ausrichtung des Flughafens auf der Grundlage der Informationen ihres Managerteams.",ESCO
Lastwagenfahrer/in,8332,35.0,2.0,Transport,62000,Sekundär II,http://data.europa.eu/esco/occupation/45037d43-a8f5-4f46-b332-b2935bc305f4,Lastkraftwagenfahrer/Lastkraftwagenfahrerin,Lastkraftwagenfahrer bedienen Fahrzeuge wie Lastkraftwagen und Lieferwagen. Sie können auch das Auf- und Abladen von Ladung übernehmen.,ESCO
Führungskräfte in der Produktion von Waren,1321,33.8,20.7,Gastgewerbe,85000,Tertiär,http://data.europa.eu/esco/occupation/6426ada1-4d8c-4612-99e3-91bc569805ee,Führungskraft in der Produktion von Waren,,ESCO
Buchhalter/in,2411,32.0,57.0,Finanzen,98000,Tertiär,http://data.europa.eu/esco/occupation/eda0d957-3c3c-4139-b89a-a18bc9e18897,Controller/Controllerin,"Controller/Controllerinnen prüfen und analysieren Jahresabschlüsse, Budgets, Finanzberichte und Geschäftspläne auf fehlerbedingte oder betrügerische Unregelmäßigkeiten und beraten ihre Kunden zu Themen wie Finanzprognose und Risikoanalyse.  Sie können Finanzdaten prüfen, Insolvenzfälle verwalten, Steuererklärungen erstellen und in Bezug auf die geltenden Rechtsvorschriften weitere Steuerberatung anbieten.",ESCO
Spitex-Mitarbeiter/in,5322,30.0,89.0,Gesundheit,58000,Sekundär II,http://data.europa.eu/esco/occupation/b91034a0-1d3e-40e4-aced-07052ee0f9e9,Mitarbeiter in der Futtermittelherstellung/Mitarbeiterin in der Futtermittelherstellung,"Mitarbeiter in der Futtermittelherstellung bedienen verschiedene Maschinen für die Futtermittelherstellung in Industrieanlagen, z. B. Mischmaschinen, Abfüllmaschinen und Verlademaschinen.",ESCO
Hochschuldozent/in,2310,30.0,37.0,Bildung,130000,Tertiär,http://data.europa.eu/esco/occupation/479ede81-bd51-4f3b-9d30-4910699fd211,Hochschullehrkraft für Journalistik,"Hochschullehrkräfte für Journalistik und Medien sind Professoren/Professorinnen, Lehrkräfte oder Dozenten/Dozentinnen, die Studierende mit einem Abschluss der Sekundarstufe II in ihrem eigenen Fachgebiet, Journalistik und Medien, unterrichten. Sie arbeiten mit ihren Forschungsassistenten/Forschungsassistentinnen und wissenschaftlichen Hilfskräften zusammen, um Lehrveranstaltungen und Prüfungen vorzubereiten, studentische Arbeiten und Prüfungen zu benoten und Evaluierungsgespräche mit Studierenden zu führen. Zudem führen sie in ihrem jeweiligen Fachgebiet der Journalistik Forschungsarbeiten durch, veröffentlichen die gewonnenen Ergebnisse und tauschen sich mit Fachkollegen/-kolleginnen aus.",ESCO
Elektriker/in EFZ,7411,30.0,3.0,Bau,80000,Sekundär II,http://data.europa.eu/esco/occupation/33960bab-4423-4808-af6c-ec2b485dba41,Bauelektriker/Bauelektrikerin,"Bauelektriker installieren und warten Stromkabel und andere elektrische Infrastrukturen in Gebäuden. Sie stellen sicher, dass Elektroinstallationen isoliert sind und dass keine Brandgefahr von ihnen ausgeht. Sie führen Bestandsaufnahmen durch und nehmen auf Anforderung Verbesserungen vor.",ESCO
Informatiker/in EFZ (Applikationsentwicklung),2512,30.0,12.0,ICT,105000,Sekundär II,http://data.europa.eu/esco/occupation/e3229e40-f571-4b26-baca-29edc8fe313e,Informatiker/Informatikerin,"Informatiker führen Forschungsarbeiten auf dem Gebiet der Computer- und Informationswissenschaft durch, um grundlegende Aspekte von IKT-Phänomenen besser zu verstehen. Sie verfassen Forschungsberichte und -vorschläge. Außerdem finden und entwickeln Informatiker neue Ansätze in der Computertechnologie, entdecken innovative Anwendungen für bestehende Technologien sowie Studien und lösen komplexe Probleme auf ihrem Gebiet.",ESCO
Maurer/in EFZ,7112,30.0,2.0,Bau,72000,Sekundär II,http://data.europa.eu/esco/occupation/05f321f8-055b-407d-bf19-e0ddabda56b7,Maurer/Maurerin,"Maurer bauen Steinmauern und Steinbauten, indem sie die Steine in einem festen Muster aufeinanderschichten und sie mit einem Bindemittel wie Zement aneinanderfügen. Anschließend füllen sie die Fugen mit Mörtel oder anderen geeigneten Materialien.",ESCO
"Reinigungs- und Hauswirtschaftleiter und -kräfte in Büros, Hotels und anderen Einrichtungen",5151,29.4,86.7,Gastgewerbe,52000,Sekundär II,http://data.europa.eu/esco/occupation/303a1e34-cb16-4054-b323-81e5eec17397,Gebäudereiniger Innenreinigung/Gebäudereinigerin Innenreinigung,"Gebäudereiniger Innenreinigung bewahren die Sauberkeit und die Gesamtfunktionen verschiedener Gebäudetypen, wie Büros, Krankenhäuser und öffentlicher Einrichtungen. Sie führen Reinigungsarbeiten durch, wie Kehren, Saugen und Wischen von Fußböden, Leeren von Mülleimern und Kontrolle von Sicherheitssystemen, Schlössern und Fenstern. Gebäudereiniger Innenreinigung prüfen Klimaanlagen und unterrichten die entsprechenden Personen bei Funktionsstörungen oder Problemen.",ESCO
Verkaufsfachkräfte,3322,29.2,35.6,Finanzen,82000,Sekundär II,http://data.europa.eu/esco/occupation/547b304b-9a72-4717-9b24-b7046df5f64e,Fachverkäufer/Fachverkäuferin,Fachverkäufer verkaufen Waren in Fachgeschäften.,ESCO
Technische Zeichner,3118,28.3,26.4,Industrie,88000,Sekundär II,http://data.europa.eu/esco/occupation/a4869ae9-2dfe-48cc-bd97-f803880f3407,Technischer Zeichner/Technische Zeichnerin,"Technische Zeichner erstellen mithilfe von Spezialsoftware oder manuellen Techniken technische Zeichnungen, aus denen die Konstruktion oder Funktionsweise einer Sache hervorgeht.",ESCO
Kraftfahrzeugmechaniker und -schlosser,7231,28.0,6.0,Industrie,78000,Sekundär II,http://data.europa.eu/esco/occupation/aaa485d0-6787-45c0-8596-b266c0b687fd,Schloss- und Schlüsselmacher/Schloss- und Schlüsselmacherin,Schloss- und Schlüsselmacher installieren und reparieren mit Spezialwerkzeugen mechanische und elektronische Schließsysteme. Sie stellen Zweitschlüssel für ihre Kunden her und öffnen in Notfällen verschlossene Türen. Bisweilen leisten Schloss- und Schlüsselmacher auch Beratung zu Sicherheitsvorkehrungen.,ESCO
Projektleiter/in (allg.),2421,28.0,32.0,Verwaltung,120000,Tertiär,http://data.europa.eu/esco/occupation/bea99fea-0383-4c63-b944-70d4799de2c5,Projektmanager/Projektmanagerin,"Projektmanager/Projektmanagerinnen stellen sicher, dass ein Projekt rechtzeitig und ohne Budgetüberschreitung abgeschlossen wird und die Projektziele erreicht werden. Sie beaufsichtigen das Projekt, leiten das Team, stellen sicher, dass die effizientesten Ressourcen eingesetzt werden, und sorgen dafür, dass alle Beteiligten zufrieden sind.",ESCO
Versicherungskaufmann/-frau,3312,28.0,50.0,Versicherungen,88000,Sekundär II,http://data.europa.eu/esco/occupation/9a39a143-d93c-4093-ba3b-47fb67ade318,Versicherungssachbearbeiter/Versicherungssachbearbeiterin,"Versicherungssachbearbeiter nehmen bei einem Versicherungsunternehmen, einer anderen Dienstleistungseinrichtung, einem selbständigen Versicherungsmakler oder einem Makler einer staatlichen Einrichtung allgemeine Sekretariats- und Verwaltungsaufgaben wahr. Sie bieten Kunden Hilfestellung und Informationen über Versicherungen an und verwalten die Unterlagen von Versicherungsverträgen.",ESCO
Koch/Köchin EFZ,3434,28.0,35.0,Gastgewerbe,58000,Sekundär II,http://data.europa.eu/esco/occupation/a256838b-0843-4ad2-a2fb-4531f94e63d8,Privatkoch/Privatköchin,"Privatköche bereiten unter Einhaltung von Lebensmittel- und Hygienevorschriften Mahlzeiten für ihre Arbeitgeber zu. Sie berücksichtigen die Unverträglichkeiten ihres Arbeitgebers in Bezug auf bestimmte Inhaltsstoffe und seine Vorlieben und kochen im Wohnhaus des Arbeitgebers. Bisweilen werden Privatköche auch aufgefordert, bei besonderen Anlässen gemeinschaftliche Abendessen oder andere Feierlichkeiten auszurichten.",ESCO
Sozialarbeiter/in,2635,28.0,70.0,Soziales,88000,Tertiär,http://data.europa.eu/esco/occupation/b73f4ce5-13fa-43a0-bbf6-01d7315849b8,Teamleiter im Bereich Sozialarbeit/Teamleiterin im Bereich Sozialarbeit,"Teamleiter im Bereich Sozialarbeit leiten die Untersuchung mutmaßlicher Fälle von Vernachlässigung oder Missbrauch unter dem Aspekt der Sozialarbeit. Sie beurteilen die Familiendynamik und helfen Menschen, die an Erkrankungen bzw. emotionalen oder psychischen Störungen leiden. Sie schulen, unterstützen und beurteilen ihnen unterstellte Sozialarbeiter und teilen diesen Aufgaben zu, um dafür zu sorgen, dass alle Arbeiten gemäß den festgelegten Strategien, Rechtsvorschriften, Verfahren und Prioritäten durchgeführt werden.",ESCO
Berufsberater und -analytiker und vergleichbare Spezialisten der Personalwesen,2423,27.6,75.4,Finanzen,115000,Tertiär,http://data.europa.eu/esco/occupation/5d0cc30d-068a-424c-8463-f42872a7149e,Berufsberater/Berufsberaterin,"Berufsberater bieten Erwachsenen und Schülern oder Studierenden Orientierung und Beratung in den Bereichen Bildung, Ausbildung und Berufswahl und unterstützen sie bei der Gestaltung ihrer beruflichen Laufbahn, indem sie ihnen Planungs- und Aufstiegsmöglichkeiten aufzeigen. Sie zeigen mögliche berufliche Entwicklungswege auf, unterstützen ihre Klienten bei der Ausbildungsplanung und helfen ihnen, über ihre Ziele, Interessen und Qualifikationen zu reflektieren. Berufsberater bieten Beratung zu verschiedenen Fragen der Laufbahnplanung und unterbreiten ggf. Vorschläge für lebenslanges Lernen oder Studienempfehlungen. Bisweilen unterstützen sie Klienten auch bei der Arbeitssuche.",ESCO
Reinigungspersonal und Hilfskräfte in Privathaushalten,9111,26.8,96.7,Dienstleistungen,46000,Keine Ausbildung,http://data.europa.eu/esco/occupation/cbad55a4-c7cf-4ab6-9540-eac72b26729b,Reinigungskraft in Privathaushalt,"Reinigungskräfte in Privathaushalten führen alle erforderlichen Reinigungsarbeiten durch, um die Häuser ihrer Kunden zu reinigen. Sie saugen und wischen Fußböden, spülen Geschirr, waschen Kleidung, übernehmen das Abstauben, Schrubben und Polieren von Oberflächen und das Desinfizieren von Geräten und Materialien.",ESCO
Landmaschinen- und Industriemaschinenmechaniker und -schlosser,7233,26.6,2.9,Industrie,78000,Sekundär II,http://data.europa.eu/esco/occupation/00c8d1cf-24f2-47d1-9f10-765e1c102811,Servicetechniker für Landmaschinen/Servicetechnikerin für Landmaschinen,"Servicetechniker für Landmaschinen warten, überholen und reparieren landwirtschaftliche Geräte und Maschinen.",ESCO
Kassierer/in,5223,25.0,75.0,Detailhandel,48000,Sekundär II,http://data.europa.eu/esco/occupation/c76dda38-938c-404e-8a6d-78c8705eebc0,Kassenaufsichtskraft,Kassenaufsichtskräfte beaufsichtigen Kassierer in Kaufhäusern und anderen großen Geschäften.,ESCO
Lagerist/in,4321,25.0,22.0,Transport,58000,Sekundär II,http://data.europa.eu/esco/occupation/d7a9f9e0-e2f5-4804-a0e0-b21ebb1403ee,Warenlagerverwalter/Warenlagerverwalterin,"Warenlagerverwalter verzeichnen den Bestand an Waren, die vor der Auslieferung an Geschäfte, Großhändler und Einzelkunden in Lagerhäusern aufbewahrt werden. Sie überprüfen das Inventar und erstellen dazu Unterlagen und Dokumente.",ESCO
Arztpraxisassistent/in,3256,25.0,95.0,Gesundheit,60000,Sekundär II,http://data.europa.eu/esco/occupation/0c041d1e-1841-4acb-b0a1-2c387a61bf65,Medizinischer Fachangestellter/Medizinische Fachangestellte,"Medizinische Fachangestellte unterstützen Ärzte bei medizinischen Maßnahmen. Sie übernehmen einfache Unterstützungstätigkeiten bei medizinischen Verfahren, standardisierten Diagnoseprogrammen und standardisierten patientennahen Tests. Sie sorgen für Hygiene bei chirurgischen Eingriffen sowie für die Reinigung, Desinfektion, Sterilisation und Wartung von medizinischen Geräten. Außerdem erfüllen sie die organisatorischen und administrativen Aufgaben, die für den Betrieb einer Arztpraxis erforderlich sind. Sie arbeiten unter Aufsicht und gemäß den Anweisungen des Arztes.",ESCO
Kinderbetreuerin/-betreuer,5311,25.0,93.0,Soziales,58000,Sekundär II,http://data.europa.eu/esco/occupation/3413f234-6230-47a8-8cc7-2691fd54ce3a,Kinderbetreuer/Kinderbetreuerin,"Kinderbetreuer übernehmen die Betreuung der Kinder, wenn die Eltern oder andere Familienmitglieder nicht verfügbar sind. Sie kümmern sich um die grundlegenden Bedürfnisse der Kinder und helfen ihnen bzw. beaufsichtigen sie beim Spielen. Kinderbetreuer können in Vorschulen, Kindertagesstätten, Kinderbetreuungseinrichtungen oder einzelnen Familien eingesetzt werden.",ESCO
Landwirt/in EFZ,6111,25.0,18.0,Landwirtschaft,52000,Sekundär II,http://data.europa.eu/esco/occupation/1c1e86f9-6347-42d6-aa6e-c95b138bf640,Landwirt/Landwirtin,Landwirte betreiben kleine Unternehmen oder sind Selbstversorger. Sie kümmern sich um alle Aspekte der Viehhaltung und des Pflanzenanbaus.,ESCO
