beruf,isco_code,beschaeftigte_1000,frauen_pct,branche,lohn_median_chf,qualifikation,esco_uri,esco_titel,esco_beschreibung,score_gesamt,score_digital,score_wiederholbarkeit,score_physisch,score_kreativitaet,score_sozial,haupt_risiko,zeitrahmen,begruendung,delta_branche,delta_lohn,score_ch,adaptabilitaet
Steuerberater/in,2412,12,42,Finanzen,120000,Tertiär,http://data.europa.eu/esco/occupation/50760da6-abc3-424c-b159-8ddf0818e016,Unternehmensbewerter/Unternehmensbewerterin,"Unternehmensbewerter/Unternehmensbewerterinnen bewerten Unternehmen, Unternehmensteile, Aktien, andere Wertpapiere und immaterielle Vermögenswerte, um ihre Kunden beim Treffen strategischer Entscheidungen wie Fusionen und Übernahmen, Rechtsstreitigkeiten, Insolvenz, Einhaltung von Steuervorschriften und Unternehmensumstrukturierung zu unterstützen.",6.4,9.0,6.5,8.0,4.0,3.5,"Automatisierung der Datenauswertung (Bilanzen, Cashflows, Vergleichstransaktionen), DCF-Modellierungen, Multiplikatoranalysen sowie standardisierte Steuerkonformitätsprüfungen durch KI-gestützte Bewertungstools",3-5 Jahre,"In der Schweiz treibt die zunehmende Digitalisierung des Finanzplatzes (FINMA-Regulierungen, Swiss GAAP FER) die Automatisierung standardisierter Bewertungsschritte voran – KI-Tools wie Bloomberg Valuation oder spezialisierte LLMs können Vergleichswertanalysen und Modellierungen bereits heute weitgehend übernehmen. Die hohe Komplexität bei Sondersituationen (M&A in regulierten Branchen, interkantonale Steueroptimierung, Holdingstrukturen) sowie das erforderliche Vertrauen bei strategischen Entscheidungen mit hohem Streitwert schützen jedoch den Kern des Berufs. Das grösste Automatisierungspotenzial liegt im mittleren Komplexitätssegment, während Expertenurteile bei strittigen Bewertungen und Litigation-Support weiterhin menschliche Expertise erfordern.",0.3,0.0,6.7,8.4
Naturwissenschaftler/in (Biologie/Chemie),2113,12,45,Industrie,105000,Tertiär,http://data.europa.eu/esco/occupation/1b123879-8f0d-4793-8069-3dc21a08921a,Applikationsspezialist Chemie/Applikationsspezialistin Chemie,Applikationsspezialisten Chemie/Applikationsspezialistinnen Chemie entwickeln kundenspezifische chemische Erzeugnisse. Sie leiten die Entwicklung von Formulierungen und Formulierungsverfahren und die Bewertung der Effizienz und Leistung der Formulierungen.,4.2,6.5,4.5,3.0,3.5,4.0,"KI-gestützte Formulierungsoptimierung und Literatursynthese: Algorithmen können Formulierungshypothesen generieren, Stabilitätstests auswerten und Datenbanken nach chemischen Wirkstoffkombinationen durchsuchen, was Teile der Entwicklungsarbeit beschleunigt oder teilersetzt.",5-10 Jahre,"In der Schweizer Chemie- und Pharmaindustrie (z.B. BASF, Clariant, Lonza) werden KI-Tools für Molecular Design und Formulierungsoptimierung bereits eingesetzt, ersetzen aber keine vollständigen Rollen. Der Beruf erfordert intensive Laborpräsenz, kreative Problemlösung bei kundenspezifischen Anforderungen sowie enge Kundenkommunikation – Faktoren, die eine vollständige Automatisierung stark hemmen. Mittelfristig dürfte KI eher als Assistenztool (z.B. generative Chemie-Modelle) wirken, das die Effizienz steigert, ohne den Kern der Tätigkeit zu ersetzen.",-0.1,0.0,4.1000000000000005,7.2
Psychologe/-pädagogin,2634,12,72,Gesundheit,90000,Tertiär,http://data.europa.eu/esco/occupation/52ded7d7-11df-42e3-b90a-d7f4b70fb4b9,Psychologe/Psychologin,"Psychologen untersuchen das Verhalten und die mentalen Prozesse beim Menschen. Sie bieten Dienstleistungen für Kunden an, die unter psychischen Problemen und schwierigen Lebenssituationen leiden, z. B. Trauer um einen Verstorbenen, Beziehungsschwierigkeiten, häusliche Gewalt und sexueller Missbrauch. Sie bieten auch Beratung für psychische Erkrankungen wie Essstörungen, posttraumatische Belastungsstörungen und Psychosen an, um den Patienten zu helfen, sich zu erholen und ein gesundes Verhalten zu erlangen.",2.8,4.5,2.5,2.5,3.0,1.0,"Dokumentation, Diagnostik-Unterstützung, standardisierte Erstgespräche (Symptomabklärung via Chatbots) sowie psychoedukative Inhalte könnten teilautomatisiert werden",>10 Jahre,"Psychologische Arbeit basiert fundamental auf therapeutischer Beziehung, Empathie und kontextsensitivem Urteilsvermögen – Kernkompetenzen, die KI nicht replizieren kann. In der Schweiz ist der Beruf seit 2013 durch das Psychologieberufegesetz (PsyG) reguliert und erfordert hohe fachliche Qualifikation; zudem ist der Fachkräftemangel im psychischen Gesundheitsbereich ausgeprägt, was eher zu KI als Assistenzwerkzeug denn als Ersatz führt. KI-Tools könnten Verwaltungsaufwand reduzieren und Diagnostik unterstützen, die eigentliche therapeutische Arbeit bleibt jedoch eine zutiefst menschliche Domäne.",-0.3,0.0,2.5,6.4
Immobilienbewirtschafter/in,3334,12,45,Immobilien,88000,Sekundär II,http://data.europa.eu/esco/occupation/5d46e448-b6bb-48e5-b245-5aad68e06085,Brennschneider/Brennschneiderin,"Brennschneider übernehmen die Einrichtung und Bedienung von Maschinen, die dafür konstruiert sind, überschüssiges Material von einem Metallwerkstück mit einem Brenner zu entfernen bzw. zu verbrennen. Dabei wird das Material bis zu seiner Entzündungstemperatur erhitzt und dann infolge einer Reaktion mit einem Sauerstoffstrom in ein Metalloxid umgewandelt, das als Schlacke aus der Fuge im Werkstück abfließt.",2.8,2.0,5.5,2.0,6.0,4.5,Automatisierte CNC-Brennschneidmaschinen und Roboterarme könnten repetitive Schneidvorgänge übernehmen; Parametrierung und Qualitätskontrolle könnten KI-gestützt optimiert werden.,5-10 Jahre,"Brennschneider arbeiten primär physisch und manuell in industriellen Umgebungen, was eine direkte KI-Substitution stark einschränkt. In der Schweizer Metallindustrie (MEM-Sektor) werden zwar zunehmend automatisierte Brennschneidanlagen eingesetzt, jedoch erfordern komplexe Werkstücke, Qualitätsbeurteilung und Maschinenwartung weiterhin menschliches Fachurteil. Die Automatisierung betrifft eher standardisierte Serienproduktion, während anspruchsvolle oder individuelle Aufträge menschliche Expertise benötigen.",0.0,0.0,2.8,4.4
HR-Manager/in,1212,12,68,Verwaltung,115000,Tertiär,http://data.europa.eu/esco/occupation/d3e32e5e-7f24-48e3-b939-e4f800eb62fb,Personalberater/Personalberaterin,"Personalberater entwickeln und implementieren Strategien, die ihren Arbeitgebern dabei helfen, im jeweiligen Wirtschaftssektor angemessen qualifizierte Mitarbeiter auszuwählen und an das Unternehmen zu binden. Sie stellen Personal ein, verfassen Stellenanzeigen, führen Vorstellungsgespräche und nehmen Bewerber in die engere Wahl auf, führen Verhandlungen mit Arbeitsagenturen und legen Arbeitsbedingungen fest. Außerdem verwalten Personalberater die Löhne und Gehälter, überprüfen diese und leisten Beratung in Bezug auf Vergütung und Arbeitsrecht. Sie organisieren Weiterbildungsmöglichkeiten, um die Leistungen der Arbeitnehmer zu steigern.",5.2,7.5,5.5,6.0,5.0,2.5,"CV-Screening, Stellenanzeigen-Erstellung, Lohnbenchmarking, administratives Vertragsmanagement und Compliance-Prüfungen (z.B. Schweizer OR/ArG) können weitgehend automatisiert werden; KI-Tools wie ATS-Systeme mit LLM-Integration übernehmen bereits Teile des Recruitingprozesses.",3-5 Jahre,"Im Schweizer HR-Kontext sind administrative Tätigkeiten wie Lohnabrechnung (AHV, BVG, UV-Meldungen) und regelbasiertes Compliance-Monitoring stark automatisierbar, während der Fachkräftemangel in der Schweiz strategische HR-Beratung und empathische Mitarbeiterbindung als menschliche Kernkompetenzen weiter aufwertet. Die hohe Mehrsprachigkeit und föderale Arbeitsrechtsstruktur der Schweiz erschweren vollständige Automatisierung, begünstigen aber KI-Assistenztools. Der Beruf wird sich in Richtung strategischer People-Analytics und Change-Management entwickeln, während operative Routinetätigkeiten zunehmend von KI übernommen werden.",0.1,0.0,5.3,7.8
Datenwissenschaftler/in / Data Scientist,2514,12,22,ICT,135000,Tertiär,http://data.europa.eu/esco/occupation/258e46f9-0075-4a2e-adae-1ff0477e0f30,Datenwissenschaftler/Datenwissenschaftlerin,"Datenwissenschaftler finden und interpretieren reichhaltige Datenquellen, verwalten große Datenmengen, führen Datenquellen zusammen, sorgen für die Konsistenz der Datensätze und erstellen Visualisierungen, um die Daten zu veranschaulichen. Sie erstellen anhand der Daten mathematische Modelle, präsentieren und vermitteln datenbezogene Erkenntnisse an Experten und Wissenschaftler in ihrem Team sowie ggf. an eine nicht fachkundige Öffentlichkeit und geben Empfehlungen zur Verwendung der Daten ab.",6.4,9.5,5.5,8.5,4.0,5.5,"Automatisierte Datenbereinigung, Feature Engineering, Modellauswahl und -training (AutoML), sowie Standardvisualisierungen und Reporting-Routinen können zunehmend von KI-Tools übernommen werden.",3-5 Jahre,"Data Scientists in der Schweiz – besonders im Finanz-, Pharma- und Technologiesektor – sind bereits stark von KI-Assistenztools (GitHub Copilot, AutoML-Plattformen) durchdrungen, was Routineaufgaben beschleunigt oder ersetzt. Gleichzeitig bleiben komplexe Problemformulierung, domänenspezifische Interpretation und die Kommunikation von Erkenntnissen an Stakeholder menschliche Kernkompetenzen, die eine vollständige Automatisierung verhindern. Der Beruf wird sich eher transformieren als verschwinden – hin zu mehr Supervision von KI-Systemen und strategischer Datenberatung.",-0.2,0.0,6.2,8.9
Hotelfachmann/-frau EFZ,5131,12,65,Gastgewerbe,58000,Sekundär II,http://data.europa.eu/esco/occupation/6ba25e0f-7fb8-4879-a1f9-d4f8945966be,Kameramann/Kamerafrau,"Kameramänner/ Kamerafrauen sind für die visuelle Interpretation des Drehbuchs und sämtliche fotografische Aspekte des Films verantwortlich, einschließlich Bildeinstellungen, Farben, Licht, Stil und Drehorte. Sie geben dem Film bzw. der Fernsehsendung ein optisches Erscheinungsbild und wählen die Drehausrüstung aus, einschließlich der Objektive und Filter. Bildgestaltende Kameramänner/-frauen leiten die Teams an, die die optischen Geräte und die Beleuchtung bedienen. Um die gewünschte Wirkung zu erzielen, arbeiten sie mit dem Film- und Fernsehregisseur/der Film- und Fernsehregisseurin zusammen.",3.2,4.0,3.5,2.5,2.0,2.5,Automatisierte Kamerasysteme und KI-gestützte Bildkomposition könnten Standardaufnahmen in kontrollierten Umgebungen übernehmen; KI-Farbkorrektur und Beleuchtungsoptimierung sind bereits teilweise automatisierbar,>10 Jahre,"Trotz der irreführenden Beschreibung (Kameramann statt Hotelfachmann) ist der Beruf Hotelfachmann/-frau EFZ durch seinen stark physischen, sozialen und situativen Charakter nur gering durch KI-Automatisierung gefährdet. In der Schweizer Hotellerie – geprägt durch hohe Qualitätsstandards und Gästeerwartungen im Premiumsegment – sind menschliche Interaktion, Empathie und kulturelles Feingefühl zentrale Anforderungen. Routineaufgaben wie Reservierungsverwaltung oder Check-in-Prozesse werden bereits durch digitale Systeme unterstützt, ersetzen jedoch nicht die ganzheitliche Gästebetreuung.",0.0,0.0,3.2,3.9
Qualitätsmanager/in,2146,12,35,Industrie,110000,Tertiär,http://data.europa.eu/esco/occupation/fdb16700-109e-4d02-949e-3213f278df93,Qualitätsbeauftragter in der Industrie/Qualitätsbeauftragte in der Industrie,"Qualitätsbeauftragte in der Industrie überwachen und kontrollieren die Informationsgüter, indem sie Verfahren für die Einhaltung von Industriestandards festlegen. Sie führen Prüfungen in industriellen Prozessen durch, beraten zu Präventiv- und Korrekturmaßnahmen und sorgen für die Einhaltung der Industriestandards.",5.9,7.5,7.0,4.5,5.5,4.5,"Automatisierte Qualitätsprüfung mittels KI-gestützter Bildverarbeitung, Anomalieerkennung in Produktionsdaten, automatische Erstellung von Prüfberichten und Compliance-Dokumentation sowie regelbasierte Ableitung von Korrekturmassnahmen",3-5 Jahre,"In der Schweizer Präzisionsindustrie (MEM-Sektor, Pharma, Medtech) werden KI-Systeme zur Echtzeit-Qualitätsüberwachung bereits eingesetzt und werden Routineprüfungen zunehmend automatisieren. Die strategische Beratungsfunktion, die Interpretation von Grenzfällen sowie die Kommunikation mit Behörden wie Swissmedic oder nach ISO-Normen bleiben jedoch menschliche Kernkompetenzen. Der Beruf wandelt sich eher als dass er verschwindet – hin zu einer Rolle, die KI-Systeme überwacht und validiert.",-0.1,0.0,5.800000000000001,7.6
Maler/in und Gipser/in EFZ,7131,12,5,Bau,68000,Sekundär II,http://data.europa.eu/esco/occupation/15620506-fb5d-49cd-87a2-1c9047fb406a,Maler/Malerin,"Maler streichen die Innen- und Außenwände von Gebäuden und anderen Bauwerken an. Dabei verwenden sie Standardfarben auf Latexbasis oder Spezialfarben, um Schutz- und Verschönerungswirkungen zu erzielen. Maler sind für verschiedene Anwendungen von Bürsten, Farbrollern und Farbspritzgeräten ausgebildet.",2.8,1.0,5.5,1.5,4.0,4.5,"Teilautomatisierung durch Malroboter für grosse, einheitliche Flächen (z.B. Fassaden, Hallenböden); KI-gestützte Farbberatungs-Apps könnten Beratungstätigkeiten teilweise übernehmen",>10 Jahre,"Der Beruf ist stark durch physische Präsenz, handwerkliches Geschick und Anpassungsfähigkeit an unstrukturierte Baustellensituationen geprägt, was eine umfassende KI-Automatisierung im Schweizer Markt sehr schwierig macht. Während erste Malerroboter existieren, sind sie auf grosse, hindernisfreie Flächen beschränkt und für die typische Schweizer Bausubstanz mit Altbauten, Stuckaturen und engen Verhältnissen kaum geeignet. Die Kombination aus Gipserarbeiten, individueller Farbgestaltung und direktem Kundenkontakt schützt den Beruf zusätzlich vor Automatisierung.",0.0,0.0,2.8,3.5
Automatiker/in EFZ,3115,12,5,Industrie,82000,Sekundär II,http://data.europa.eu/esco/occupation/5d46e448-b6bb-48e5-b245-5aad68e06085,Brennschneider/Brennschneiderin,"Brennschneider übernehmen die Einrichtung und Bedienung von Maschinen, die dafür konstruiert sind, überschüssiges Material von einem Metallwerkstück mit einem Brenner zu entfernen bzw. zu verbrennen. Dabei wird das Material bis zu seiner Entzündungstemperatur erhitzt und dann infolge einer Reaktion mit einem Sauerstoffstrom in ein Metalloxid umgewandelt, das als Schlacke aus der Fuge im Werkstück abfließt.",4.2,2.0,7.5,2.5,3.5,7.5,CNC-gesteuerte und roboterbasierte Brennschneidanlagen können repetitive Schneidvorgänge zunehmend autonom ausführen; Parametrisierung und Qualitätskontrolle könnten durch KI-Bildverarbeitung übernommen werden.,5-10 Jahre,"Brennschneidprozesse sind zwar strukturiert und regelbasiert, erfordern jedoch erhebliche physische Präsenz sowie handwerkliches Urteilsvermögen bei unregelmässigen Werkstücken oder Materialvariationen. In der Schweizer Metallindustrie (MEM-Sektor) sind Automatisierungsinvestitionen hoch, jedoch sind vollautonome Systeme für komplexe oder KMU-typische Kleinserienfertigung noch nicht wirtschaftlich rentabel. Die Rolle des Automatiker/in EFZ umfasst zudem Einrichtung, Wartung und Prozessoptimierung, was über reine Schneidtätigkeit hinausgeht und die KI-Exposition dämpft.",-0.1,0.0,4.1000000000000005,4.3
Zugbegleiter/in / Lokführer/in,8311,12,18,Transport,80000,Sekundär II,http://data.europa.eu/esco/occupation/ea034d66-0d35-4891-b82c-6434cad2c76f,Zugbegleiter/Zugbegleiterin,"Zugbegleiter unterstützen die Fahrgäste beim Ein- und Aussteigen. Sie beantworten Fragen der Fahrgäste hinsichtlich der Regeln für den Bahnverkehr und zu Bahnhöfen und erteilen Fahrplanauskünfte. Sie kontrollieren oder verkaufen Einzel- oder Zeitfahrkarten und unterstützen den Leiter des Zugbegleiterteams bei seinen operativen Aufgaben, z. B. in Bezug auf das Schließen der Türen oder eine bestimmte operative Kommunikation. Bei technischen Zwischenfällen und Notfällen sorgen sie für ein sicheres Verhalten der Fahrgäste.",4.2,4.5,6.5,3.0,7.5,3.5,"Fahrkartenkontrolle und -verkauf via automatische Validierungssysteme und digitale Tickets (wie SBB-App), sowie Fahrplanauskünfte durch KI-Chatbots und Bordsysteme; autonomes Fahren könnte langfristig die Lokführerfunktion ersetzen",5-10 Jahre,"Die SBB und andere Schweizer Bahnbetreiber digitalisieren bereits stark (SwissPass, automatische Ticketkontrolle, digitale Anzeigen), sodass administrative Aufgaben des Zugbegleiters zunehmend wegfallen. Jedoch erfordern Notfallmanagement, Fahrgastbetreuung bei Störungen und physische Präsenz im Zug weiterhin menschliches Urteilsvermögen und Empathie, was eine vollständige Automatisierung verzögert. Das autonome Fahren im Schienenbereich (z.B. Pilotprojekte bei SBB Cargo) entwickelt sich, aber regulatorische Anforderungen und Sicherheitsvorschriften in der Schweiz bremsen den Zeitplan.",0.0,0.0,4.2,4.7
Bauführer/in,3123,10,8,Bau,105000,Tertiär,http://data.europa.eu/esco/occupation/5d46e448-b6bb-48e5-b245-5aad68e06085,Brennschneider/Brennschneiderin,"Brennschneider übernehmen die Einrichtung und Bedienung von Maschinen, die dafür konstruiert sind, überschüssiges Material von einem Metallwerkstück mit einem Brenner zu entfernen bzw. zu verbrennen. Dabei wird das Material bis zu seiner Entzündungstemperatur erhitzt und dann infolge einer Reaktion mit einem Sauerstoffstrom in ein Metalloxid umgewandelt, das als Schlacke aus der Fuge im Werkstück abfließt.",3.8,1.5,6.5,2.0,4.0,5.5,Automatisierte CNC-Brennschneidmaschinen und Robotersysteme können repetitive Schneidvorgänge übernehmen; KI-gestützte Qualitätskontrolle kann Schlackebildung und Schnittqualität überwachen,3-5 Jahre,"In der Schweizer Metallindustrie sind CNC-Brennschneidanlagen bereits weit verbreitet, weshalb rein manuelle Brennschneidarbeiten zunehmend seltener werden. Allerdings erfordert die Einrichtung, Überwachung und Fehlerbehebung von Maschinen sowie die Arbeit an komplexen oder irregulären Werkstücken weiterhin menschliches Urteilsvermögen und physische Präsenz vor Ort. Die starke Gewerkschaftsstruktur und der hohe Qualitätsanspruch in der Schweiz verlangsamen zudem den vollständigen Ersatz durch Automatisierung.",0.0,0.0,3.8,5.9
Versicherungsexperte/-expertin,2422,10,38,Versicherungen,115000,Tertiär,http://data.europa.eu/esco/occupation/3d190639-90f8-4402-b1b3-a104a17e0d67,Experte für Datenintegration/Expertin für Datenintegration,Experten für Datenintegration führen die Integration verschiedener Datenbanken durch. Sie pflegen die Integration und gewährleisten Interoperabilität.,7.2,9.0,7.5,8.5,6.0,6.5,"Automatisierung der Datenmapping- und ETL-Prozesse (Extract, Transform, Load), automatische Schema-Erkennung, Anomalieerkennung in Datenflüssen sowie KI-gestützte Interoperabilitätslösungen, die manuelle Integrationsarbeit ersetzen.",3-5 Jahre,"In der Schweizer Versicherungsbranche, die stark reguliert ist (FINMA), treiben Unternehmen wie Zurich, Swiss Re und AXA die Datenintegration mit KI-Tools wie automatisierten Datenpipelines und ML-basiertem Schema-Matching bereits voran. Routineaufgaben wie Datenbankabgleiche, Interoperabilitätsprüfungen und Standard-ETL-Prozesse sind hochgradig strukturiert und daher gut automatisierbar. Komplexere Integrationsarchitekturen und regulatorische Anforderungen (z.B. Datenschutzgesetz DSG) erfordern jedoch weiterhin menschliche Expertise, was eine vollständige Automatisierung kurzfristig unwahrscheinlich macht.",0.4,0.0,7.6,7.9
Chemieingenieur/in / Verfahrenstechniker/in,2145,10,25,Industrie,118000,Tertiär,http://data.europa.eu/esco/occupation/ec21ce88-ce14-49b6-be0a-cc53cf5a3a67,Chemieingenieur/Chemieingenieurin,"Chemieingenieure/Chemieingenieurinnen entwerfen und entwickeln chemische und physikalische Großmengen-Herstellungsverfahren und sind in den gesamten industriellen Prozess eingebunden, der für die Umwandlung von Rohstoffen in Produkte erforderlich ist.",4.8,6.5,5.5,3.5,3.5,4.0,"Prozessoptimierung, Simulation chemischer Verfahren, Datenanalyse von Produktionsprozessen und Qualitätskontrolle könnten durch KI-gestützte Systeme (z.B. digitale Zwillinge, ML-basierte Prozesssteuerung) zunehmend automatisiert werden.",5-10 Jahre,"In der Schweizer Chemieindustrie (Novartis, Roche, Lonza, BASF Schweiz) wird KI bereits für Prozessoptimierung und Qualitätssicherung eingesetzt, ersetzt aber kaum die ganzheitliche Ingenieurverantwortung. Die Kombination aus physischer Anlagenpräsenz, komplexem Sicherheitsmanagement und kreativer Verfahrensentwicklung schützt den Beruf vor vollständiger Automatisierung. Routineaufgaben wie Datenauswertung, Prozessüberwachung und Berichterstattung werden jedoch zunehmend durch KI-Tools unterstützt oder teilautomatisiert.",-0.1,0.0,4.7,7.5
Grafiker/in,2166,10,45,Medien,80000,Tertiär,http://data.europa.eu/esco/occupation/802a0e5d-5625-4166-a1f0-d13e2586df55,Grafiker/Grafikerin,"Grafiker gravieren oder ätzen Bilder in Metall, Holz, Gummi oder andere Materialien. Diese Bilder werden anschließend, in der Regel mithilfe einer Druckerpresse, auf andere Oberflächen übertragen. Grafiker verwenden häufig Werkzeuge wie Radiernadeln, Pantografen und spezielle Siebe.",3.2,2.0,5.0,2.0,3.0,5.0,Digitale Bildbearbeitung und CNC-gesteuerte Gravurmaschinen könnten repetitive Gravur- und Ätzvorgänge teilweise übernehmen; KI-gestützte Design-Tools könnten Vorlagen automatisch generieren.,>10 Jahre,"Der Beruf in seiner klassischen Ausprägung – manuelles Gravieren und Ätzen mit Handwerkzeug – ist stark physisch und handwerklich geprägt, was eine direkte KI-Automatisierung erheblich erschwert. In der Schweiz ist dieses Handwerk teils im Bereich Uhrenindustrie und Kunsthandwerk verankert, wo Präzision und künstlerischer Ausdruck hochgeschätzt werden und Qualitätsprämien existieren. Zwar können CNC-Maschinen und digitale Werkzeuge einzelne Teilschritte übernehmen, doch die Kombination aus Kreativität, haptischer Kontrolle und handwerklichem Können macht eine vollständige Automatisierung auf absehbare Zeit unwahrscheinlich.",0.0,0.0,3.2,5.7
Hauswirtschaftler/in EFZ,5131,10,92,Dienstleistungen,52000,Sekundär II,http://data.europa.eu/esco/occupation/5d46e448-b6bb-48e5-b245-5aad68e06085,Brennschneider/Brennschneiderin,"Brennschneider übernehmen die Einrichtung und Bedienung von Maschinen, die dafür konstruiert sind, überschüssiges Material von einem Metallwerkstück mit einem Brenner zu entfernen bzw. zu verbrennen. Dabei wird das Material bis zu seiner Entzündungstemperatur erhitzt und dann infolge einer Reaktion mit einem Sauerstoffstrom in ein Metalloxid umgewandelt, das als Schlacke aus der Fuge im Werkstück abfließt.",3.2,1.5,5.5,2.0,5.0,3.5,Teilautomatisierung repetitiver Schneidprozesse durch CNC-gesteuerte Brennschneidmaschinen und automatisierte Qualitätskontrolle via Kamerasysteme,5-10 Jahre,"Brennschneider arbeiten stark physisch und ortsgebunden, was eine vollständige KI-Automatisierung erheblich erschwert. In der Schweizer Metallverarbeitungsindustrie sind CNC-Brennschneidanlagen bereits verbreitet, jedoch erfordern Einrichtung, Überwachung und Anpassung an unregelmässige Werkstücke weiterhin menschliches Fachwissen. Mittelfristig könnten robotergestützte Systeme einfache, serielle Schneidaufgaben übernehmen, während komplexe oder sicherheitskritische Tätigkeiten menschliche Fachkräfte benötigen.",0.0,0.0,3.2,3.5
Chemielaborant/in EFZ,3113,10,45,Industrie,78000,Sekundär II,http://data.europa.eu/esco/occupation/87775d69-ae88-449e-ad71-6f9875711816,Chemielaborant/Chemielaborantin,"Chemielaboranten überwachen chemische Prozesse und analysieren chemische Stoffe für Produktions- oder wissenschaftliche Zwecke. Sie arbeiten in Labors oder Produktionsstätten, in denen sie Chemiker bei ihrer Arbeit unterstützen. Chemielaboranten üben Labortätigkeiten aus, testen chemische Stoffe, analysieren Daten und berichten über die Ergebnisse ihrer Arbeit.",4.9,6.5,6.5,3.5,5.5,7.5,"Routinemässige Datenanalyse, Qualitätskontrollmessungen und Protokollierung von Analyseergebnissen könnten durch KI-gestützte Labor-Automatisierungssysteme und Robotik übernommen werden; standardisierte Probenanalysen (HPLC, Titrationen) sind besonders exponiert.",5-10 Jahre,"In der Schweizer Pharmaindustrie (Novartis, Roche, Lonza) werden bereits erhebliche Investitionen in Labor-Automatisierung und digitale Workflows getätigt, was Routinetätigkeiten mittelfristig teilweise ersetzen wird. Die starke physische Komponente – Handhabung von Substanzen, Gerätekalibrierung, Sicherheitsverantwortung im Labor – schützt den Beruf jedoch vor vollständiger Automatisierung. Das EFZ-Profil wird sich wahrscheinlich in Richtung Überwachung und Wartung automatisierter Systeme verschieben, anstatt zu verschwinden.",-0.1,0.0,4.800000000000001,5.1
Mechatroniker/in EFZ,7421,10,4,Industrie,85000,Sekundär II,http://data.europa.eu/esco/occupation/0ec62c2e-30c9-434e-bf36-5277a0840450,Kraftfahrzeugmechatroniker in der Fahrzeugmodernisierung/Kraftfahrzeugmechatronikerin in der Fahrzeugmodernisierung,"Kraftfahrzeugmechatroniker in der Fahrzeugmodernisierung übernehmen die Reparatur und Instandsetzung der Innenteile von Fahrzeugen, beispielsweise Motorteile und Dieseleinspritzpumpen.",3.2,3.5,5.5,2.0,4.5,5.5,Diagnostik und Fehleranalyse über KI-gestützte OBD-Systeme sowie automatisierte Bestellprozesse für Ersatzteile; mittelfristig könnten Robotersysteme einfache Austauscharbeiten übernehmen,>10 Jahre,"Kraftfahrzeugmechatroniker arbeiten stark physisch und situationsabhängig – jedes Fahrzeug und jeder Defekt bringt individuelle Herausforderungen mit sich, was eine vollständige Automatisierung sehr schwierig macht. In der Schweiz, wo Präzisionsarbeit und Qualitätsstandards sehr hoch sind, bleibt menschliche Expertise besonders wertvoll. KI wird eher als unterstützendes Diagnosetool eingesetzt (z.B. bei modernen Fahrzeugelektroniken) als als Ersatz für den Fachmann.",-0.1,0.0,3.1,4.7
