beruf,isco_code,beschaeftigte_1000,frauen_pct,branche,lohn_median_chf,qualifikation,esco_uri,esco_titel,esco_beschreibung,score_gesamt,score_digital,score_wiederholbarkeit,score_physisch,score_kreativitaet,score_sozial,haupt_risiko,zeitrahmen,begruendung,delta_branche,delta_lohn,score_ch,adaptabilitaet
Zimmermann/-frau EFZ,7115,18,2,Bau,76000,Sekundär II,http://data.europa.eu/esco/occupation/2a22ff9e-de3b-408d-b312-5034896cc4f4,Zimmerer/Zimmerin,"Zimmerer sägen, formen und montieren Holzelemente für Gebäude und andere Bauwerken. Sie verwenden für ihre Arbeit auch Materialien wie Kunststoffe und Metalle. Zimmerer fertigen die Rahmen für nach der Holrahmenbauweise errichtete Häuser.",2.4,1.5,4.5,1.5,3.5,4.0,CNC-gesteuerte Abbundanlagen und digitale Planungssoftware (CAD/CAM) können die Zuschnitt- und Vorfertigungsphase teilweise automatisieren; Aufmassnahme könnte durch 3D-Scanning unterstützt werden.,>10 Jahre,"Zimmerleute arbeiten primär physisch auf wechselnden Baustellen in der Schweiz, was einer vollständigen Automatisierung fundamental entgegensteht. Zwar sind CNC-Abbundmaschinen in Schweizer Holzbaubetrieben bereits verbreitet, doch die Montage, Anpassung an individuelle Bausituationen und handwerkliche Problemlösung vor Ort bleiben schwer automatisierbar. Der Schweizer Holzbau boomt und setzt auf qualifizierte Fachkräfte, was den Beruf mittelfristig absichert, auch wenn digitale Tools die Vorfertigung weiter optimieren werden.",0.0,0.0,2.4,3.8
IT-Projektleiter/in,2511,18,18,ICT,130000,Tertiär,http://data.europa.eu/esco/occupation/bea99fea-0383-4c63-b944-70d4799de2c5,Projektmanager/Projektmanagerin,"Projektmanager/Projektmanagerinnen stellen sicher, dass ein Projekt rechtzeitig und ohne Budgetüberschreitung abgeschlossen wird und die Projektziele erreicht werden. Sie beaufsichtigen das Projekt, leiten das Team, stellen sicher, dass die effizientesten Ressourcen eingesetzt werden, und sorgen dafür, dass alle Beteiligten zufrieden sind.",5.2,8.5,5.5,7.0,4.5,2.5,"Automatisierung von Statusreporting, Ressourcenplanung, Risikoerkennung, Fortschrittsverfolgung und Dokumentation durch KI-gestützte Projektmanagement-Tools (z.B. Microsoft Copilot in Project, Asana AI)",3-5 Jahre,"IT-Projektleiter/innen arbeiten stark mit digitalen Informationen und strukturierten Prozessen, was Teilbereiche wie Reporting, Zeitplanung und Risikoanalyse zunehmend KI-automatisierbar macht. Jedoch bleiben Stakeholder-Management, politische Verhandlungen und situative Entscheidungsfindung – besonders im Schweizer Kontext mit mehrsprachigen Teams, hohen Qualitätsansprüchen und komplexen Unternehmensstrukturen – stark auf menschliche Urteilsfähigkeit angewiesen. KI wird die Rolle eher transformieren als ersetzen, wobei administrative Tätigkeiten wegfallen und die strategische sowie zwischenmenschliche Komponente an Gewicht gewinnt.",-0.2,0.0,5.0,8.6
Servicemitarbeiter/in,5131,18,58,Gastgewerbe,48000,Sekundär II,http://data.europa.eu/esco/occupation/9653fb92-ad48-4865-a471-f270302fa93b,Reiseberater der Bahn/Reiseberaterin der Bahn,"Reiseberater der Bahn kümmern sich um Kunden am Bahnhof, beantworten ihre Fragen und reagieren schnell und sicher auf unerwartete Situationen. Sie erteilen Auskünfte, leisten Mobilitätshilfe und sorgen für Sicherheit in Bahnhöfen. Sie geben präzise und aktuelle Auskünfte über Ankunfts- und Abfahrtszeiten sowie Zugverbindungen und helfen den Kunden bei der Reiseplanung.",4.2,6.5,5.5,3.0,4.5,3.0,"Standardauskünfte zu Fahrplänen, Verbindungen und Verspätungen könnten durch KI-Chatbots, digitale Informationskioske und die SBB-App vollständig übernommen werden. Die Reiseplanung für einfache Anfragen ist bereits weitgehend automatisiert.",3-5 Jahre,"Die SBB investiert stark in digitale Self-Service-Lösungen und KI-gestützte Kundenberatung, was Standardaufgaben wie Fahrplanauskünfte zunehmend automatisiert. Jedoch erfordert die physische Präsenz im Bahnhof, die Mobilitätshilfe für Menschen mit Beeinträchtigungen sowie der Umgang mit unvorhersehbaren Situationen (Zugausfälle, Sicherheitsvorfälle) weiterhin menschliches Urteilsvermögen und Einfühlungsvermögen. Der Schweizer Qualitätsanspruch im öffentlichen Verkehr sowie regulatorische Anforderungen zur Barrierefreiheit dürften den vollständigen Ersatz durch Automatisierung verzögern.",0.0,0.0,4.2,4.2
Gymnasiallehrer/in,2330,18,46,Bildung,120000,Tertiär,http://data.europa.eu/esco/occupation/5efb2c08-ba3a-4659-a2e4-1883f54e77b6,Lehrkraft Sekundarstufe,"Lehrkräfte Sekundarstufe unterrichten Schülerinnen und Schüler, in der Regel Kinder und junge Erwachsene, in einer Schule des Sekundarbereichs. Sie sind in der Regel Fachlehrkräfte, die in dem Fach ihrer Spezialisierung unterrichten. Sie erstellen Unterrichtspläne und -materialien, beobachten die Fortschritte der Schülerinnen und Schüler, bieten bei Bedarf ihre individuelle Hilfestellung und bewerten die Kenntnisse der Schülerinnen und Schüler anhand von Aufgaben, Tests und Prüfungen.",3.2,5.5,4.0,2.5,3.0,1.5,"Erstellung von Unterrichtsmaterialien, Aufgabenkorrektur und administrative Aufgaben (Lehrplanplanung, Notengebung) könnten teilweise durch KI-Tools unterstützt oder automatisiert werden",5-10 Jahre,"Gymnasiallehrkräfte in der Schweiz sind durch ihren hohen Anspruch an Fachtiefe, pädagogische Beziehungsarbeit und Maturitätsvorbereitung stark vor vollständiger Automatisierung geschützt. Die Schweizer Bildungskultur, die kantonale Regulierung sowie der Fokus auf kritisches Denken und mündliche Maturitätsprüfungen erfordern zwingend menschliche Präsenz und Urteilsvermögen. KI wird als Hilfsmittel zunehmend integriert (z.B. Differenzierung, Materialerstellung), ersetzt die Lehrkraft aber nicht, sondern verändert deren Rolle.",-0.2,0.0,3.0,7.6
Filialleiter/in (Detailhandel),1420,15,55,Detailhandel,78000,Sekundär II,http://data.europa.eu/esco/occupation/bdfb48e0-79dc-4b63-8470-db2e03b37326,Verkaufsaufsichtskraft,"Verkaufsaufsichtskräfte sind für reibungslose Abläufe in Geschäften gemäß den gesetzlichen Vorschriften und den Unternehmensrichtlinien zuständig. Sie beaufsichtigen geschäftliche Tätigkeiten in den Bereichen Budget, Inventar und Kundendienst. Ferner überwachen Verkaufsaufsichtskräfte die Leistung der Mitarbeiter und stellen sicher, dass die Ziele erreicht werden.",4.2,6.5,5.0,3.5,4.5,2.5,"Automatisierung von Inventarverwaltung, Budgetüberwachung, Dienstplanerstellung und Leistungsreporting durch KI-gestützte Retail-Management-Systeme; teilweise Substitution durch autonome Kassensysteme und KI-Kundenservice",5-10 Jahre,"In der Schweiz investieren grosse Detailhändler wie Migros, Coop und Digitec zunehmend in KI-gestützte Warenwirtschafts- und Analysesysteme, die administrative Aufgaben der Filialleitung teilweise übernehmen können. Die Kernkompetenz der Führungsrolle – Mitarbeitermotivation, Konfliktmanagement, Kundenbindung und situatives Urteilen im Tagesgeschäft – erfordert jedoch starke soziale und kontextuelle Fähigkeiten, die schwer automatisierbar bleiben. Eine vollständige Substitution ist unwahrscheinlich; wahrscheinlicher ist eine Transformation der Rolle hin zu stärker datengetriebener Führung mit KI als Assistenz.",0.2,0.0,4.4,5.0
Vermögensverwalter/in / Wealth Manager,2413,15,28,Finanzen,180000,Tertiär,http://data.europa.eu/esco/occupation/e20eee17-4876-4f21-a0cb-5d7f40c63cd8,Vermögensverwalter/Vermögensverwalterin,"Vermögensverwalter investieren das Geld ihrer Kunden in finanzielle Vermögenswerte, z. B. Anlageinstrumente wie Investmentfonds, oder verwalten die Portfolios einzelner Kunden. Dazu gehört die Verwaltung der finanziellen Vermögenswerte im Rahmen einer bestimmten Anlagestrategie und eines bestimmten Risikorahmens, die Bereitstellung von Informationen sowie die Bewertung und Überwachung von Risiken.",6.1,9.0,6.5,7.5,5.5,2.5,"Portfolio-Optimierung, Risikoanalyse, Marktüberwachung und regelbasierte Anlageentscheidungen können durch KI-gestützte Robo-Advisors und algorithmisches Trading weitgehend automatisiert werden; Reporting und Compliance-Dokumentation sind ebenfalls hochgradig automatisierbar.",3-5 Jahre,"Die Schweiz als globales Wealth-Management-Zentrum (UBS, Julius Bär, Pictet) investiert massiv in KI-gestützte Analysetools, wobei standardisierte Portfolioverwaltung und Massenkundensegmente bereits stark von Robo-Advisory-Lösungen durchdrungen werden. Dennoch bleibt das Kernelement der Schweizer Vermögensverwaltung – das tiefe Vertrauensverhältnis zu ultra-high-net-worth Kunden, oft über Generationen hinweg – ein robuster Schutzfaktor gegen vollständige Automatisierung. Das Risiko liegt primär in der Automatisierung der analytischen Zuarbeit, was die Anzahl benötigter Fachkräfte reduziert, ohne den Beruf vollständig zu ersetzen.",0.3,0.0,6.3999999999999995,9.7
Elektroingenieur/in,2151,15,10,Industrie,122000,Tertiär,http://data.europa.eu/esco/occupation/e69697d0-2639-4aad-b73a-05e0b98357b1,Elektroingenieur Bergbau/Elektroingenieurin Bergbau,"Elektroingenieure Bergbau/Elektroingenieurinnen Bergbau beaufsichtigen die Beschaffung, Installation und Instandhaltung von elektrischen Bergbaugeräten mithilfe ihrer Elektrik- und Elektronikkenntnisse. Sie organisieren den Austausch und die Reparatur von elektrischen Geräten und Bauteilen.",3.8,4.5,5.0,2.5,4.0,5.5,Diagnose- und Überwachungsaufgaben könnten durch KI-gestützte Sensorik und Predictive-Maintenance-Systeme teilweise automatisiert werden; Beschaffungsprozesse und Dokumentation könnten durch digitale Tools optimiert werden.,5-10 Jahre,"Elektroingenieure im Bergbau sind stark auf physische Präsenz vor Ort angewiesen, da sie in komplexen, unstrukturierten Bergbauumgebungen arbeiten – ein erheblicher Schutzfaktor gegenüber KI-Automatisierung. In der Schweiz spielt der Bergbausektor (z.B. Tunnelbau, Steinbrüche) eine Nischenrolle, was spezifische regulatorische Anforderungen und Sicherheitsstandards (SUVA) mit sich bringt, die menschliches Urteilsvermögen erfordern. Die Kombination aus problemlösungsorientierten Tätigkeiten, sicherheitskritischen Entscheidungen und Koordination mit Teams macht eine vollständige Automatisierung mittelfristig unwahrscheinlich.",-0.1,0.0,3.7,7.2
ICT-Supporter/in,3512,15,15,ICT,80000,Sekundär II,http://data.europa.eu/esco/occupation/0ce5a9f4-e00a-4bbe-b255-3c63407167a4,IKT-Sicherheitsberater/IKT-Sicherheitsberaterin,IKT-Sicherheitsberater empfehlen und implementieren Lösungen für die Kontrolle des Zugangs zu Daten und Programmen. Sie fördern einen sicheren Informationsaustausch.,6.1,8.5,6.5,6.0,5.5,5.0,"Automatisierte Bedrohungserkennung, Ticket-Klassifizierung, Sicherheits-Audits und standardisierte Zugangsverwaltung können durch KI-Systeme übernommen werden; Level-1/Level-2-Support wird zunehmend durch KI-Chatbots und automatisierte Diagnosetools ersetzt",3-5 Jahre,"In der Schweiz, wo viele Unternehmen hohe Compliance-Anforderungen (FINMA, DSG) haben, bleibt menschliche Expertise für komplexe Sicherheitsentscheidungen und regulatorische Beratung vorerst unersetzlich. Repetitive Support-Aufgaben wie Passwortrücksetzungen, Standardkonfigurationen und Log-Analysen werden jedoch bereits heute zunehmend automatisiert. Der Beruf wird sich wandeln: Einfache Support-Tätigkeiten werden wegfallen, während strategische Sicherheitsberatung und die Überwachung von KI-Sicherheitssystemen an Bedeutung gewinnen.",-0.2,0.0,5.8999999999999995,6.0
Gärtner/in EFZ,6113,15,35,Landwirtschaft,56000,Sekundär II,http://data.europa.eu/esco/occupation/98af7387-3974-457a-aa57-5397d1ea3949,Landschaftsgärtner für Innenraumbegrünung/Landschaftsgärtnerin für Innenraumbegrünung,"Landschaftsgärtner für Innenraumbegrünung entwerfen, installieren, pflegen und erhalten Grünflächen in Innenräumen entsprechend den Anforderungen der Kunden.",2.4,2.0,4.5,1.5,3.0,3.5,Planung und Beratung von Bepflanzungskonzepten könnte durch KI-gestützte Designtools teilweise unterstützt werden; Routineaufgaben wie Bewässerungssteuerung und Pflegepläne sind bereits automatisierbar.,>10 Jahre,"Der Beruf ist stark durch physische, manuelle Tätigkeiten geprägt – Pflanzen einsetzen, pflegen und installieren erfordert Fingerfertigkeit und situatives Urteilsvermögen, das Robotik noch lange nicht zuverlässig ersetzen kann. In der Schweiz ist zudem die enge Kundenbeziehung und individuelle Beratung (z.B. für Büro- oder Gastrobegrünung) ein zentrales Merkmal, das menschliche Kompetenz voraussetzt. KI kann unterstützend wirken (z.B. Pflegemanagement-Apps, Sensorik für Bewässerung), ersetzt aber den Beruf in absehbarer Zeit nicht.",0.0,0.0,2.4,3.7
ÖV-Fahrer/in (Bus/Tram),8331,15,12,Transport,65000,Sekundär II,http://data.europa.eu/esco/occupation/3a15ec1b-9250-41a0-9344-feb2956481b7,Oberleitungsbusfahrer/Oberleitungsbusfahrerin,"Oberleitungsbusfahrer bedienen Oberleitungsbusse oder Linienbusse, nehmen Fahrpreise ein und betreuen Fahrgäste.",4.2,3.0,7.0,2.5,2.0,3.5,Autonomes Fahren auf definierten Linienrouten sowie automatische Fahrscheinprüfung und Ticketverkauf könnten mittelfristig übernommen werden,>10 Jahre,"Obwohl die Fahrtrouten strukturiert und repetitiv sind, erfordert das Führen eines Busses oder Trams im dichten Schweizer Stadtverkehr komplexe Echtzeit-Reaktionen auf unvorhersehbare Situationen, Fussgänger und andere Verkehrsteilnehmer. In der Schweiz laufen zwar Pilotprojekte mit autonomen Kleinbussen (z.B. PostAuto), doch der reguläre Linienverkehr mit Gelenkbussen in Städten wie Zürich oder Genf bleibt aufgrund rechtlicher, sicherheitstechnischer und infrastruktureller Hürden langfristig auf menschliche Fahrer angewiesen. Die Betreuung von Fahrgästen, das Umgehen mit Störungen sowie die Verantwortung für die Fahrgastsicherheit erfordern menschliches Urteilsvermögen und soziale Kompetenz.",0.0,0.0,4.2,4.1
Sanitärinstallateur/in EFZ,7126,15,2,Bau,78000,Sekundär II,http://data.europa.eu/esco/occupation/ed3cf43d-c2c1-4c46-82fc-1375e27e0290,Gas- und Sanitärinstallateur/Gas- und Sanitärinstallateurin,"Gas- und Sanitärinstallateure warten und installieren Wasser-, Gas- und Abwassersysteme. Sie kontrollieren die Rohrleitungen und Armaturen regelmäßig und führen bei Bedarf Reparaturen aus. Sie biegen, schneiden und installieren Rohrleitungen. Sie testen die Systeme und nehmen auf sichere und vorschriftsmäßige Weise Anpassungen vor. Sie bringen Sanitäreinrichtungen an.",2.1,1.5,4.5,1.5,3.5,3.5,Diagnostik und Fehleranalyse via KI-gestützte Sensorik und digitale Planungstools (BIM) könnten Teile der Planungs- und Inspektionsarbeit unterstützen oder teilweise ersetzen,>10 Jahre,"Sanitärinstallateure arbeiten primär physisch in schwer zugänglichen, variablen Umgebungen (Altbauten, Steigzonen, enge Schächte), was eine vollständige Automatisierung durch Robotik auf absehbare Zeit ausschliesst. In der Schweiz mit ihrem hohen Lohnniveau und strengen Normen (SVGW-Richtlinien, kantonale Bauvorschriften) ist Qualitätssicherung durch ausgebildete Fachkräfte gesetzlich verankert. KI kann allenfalls bei Dokumentation, Materialplanung oder Leckage-Diagnose via Sensornetze unterstützen, ersetzt aber nicht die manuelle Handwerksarbeit.",0.0,0.0,2.1,3.8
Maschinenführer/in,8211,15,15,Industrie,62000,Sekundär II,http://data.europa.eu/esco/occupation/71a98a24-e02b-4ba6-b4df-6556d7ae98cc,Maschinenführer in der Papierwarenerzeugung/Maschinenführerin in der Papierwarenerzeugung,"Maschinenführer in der Papierwarenerzeugung arbeiten mit Maschinen, die einen oder mehrere Vorgänge an Papier durchführen, um es für bestimmte Märkte geeignet zu machen, z. B. Lochen, Perforieren, Falten und Überziehen mit einer Kohlenstoffschicht.",5.8,2.5,8.5,3.0,7.5,8.0,"Automatisierte Steuerungssysteme und Robotik können das Einrichten, Überwachen und Bedienen von Papierverarbeitungsmaschinen (Lochen, Perforieren, Falten) übernehmen; KI-gestützte Qualitätskontrolle per Bildverarbeitung ersetzt manuelle Sichtprüfung",5-10 Jahre,"Die hochgradig repetitiven und regelbasierten Tätigkeiten in der Papierwarenproduktion sind prinzipiell gut automatisierbar, jedoch erfordert die physische Maschinenbedienung, Fehlerbehebung und Rüstvorgänge weiterhin menschliche Präsenz. In der Schweiz mit ihren hohen Lohnkosten besteht ein starker wirtschaftlicher Anreiz zur Automatisierung, jedoch verlangsamen hohe Investitionskosten und die Komplexität heterogener Produktionslinien den Übergang. Bestehende Anlagen in KMU der Schweizer Papierverarbeitungsbranche werden schrittweise modernisiert, was den vollständigen Ersatz eher in einem 5-10 Jahres-Horizont verortet.",-0.1,0.0,5.7,4.0
Berufsschullehrer/in,2320,15,35,Bildung,115000,Tertiär,http://data.europa.eu/esco/occupation/81f8d141-3f67-4fb0-a349-db0147ef7b3a,Lehrkraft im Bereich Berufsbildung,"Lehrkräfte im Bereich Berufsbildung unterrichten Schülerinnen/Schüler in ihrem Fachgebiet, was überwiegend praktischer Natur ist. Sie vermitteln theoretische Kenntnisse, um die praktischen Fertigkeiten und Techniken zu fördern, die die Schüler/Schülerinnen später beherrschen müssen, um in einem Beruf der von ihnen gewählten Fachrichtung zu arbeiten, und fördern die die Entwicklung der entsprechenden Einstellungen und Werte. Lehrkräfte im Bereich Berufsbildung überwachen die Fortschritte der Schülerinnen und Schüler, helfen bei Bedarf individuell und bewerten ihr Wissen und ihre Leistungen mithilfe von Aufgaben, Tests und Prüfungen.",3.1,4.5,3.5,2.5,3.0,2.0,"Automatisierte Erstellung von Lernmaterialien, adaptive Lernplattformen für Theorieinhalte sowie KI-gestützte Bewertung von Tests und schriftlichen Aufgaben",5-10 Jahre,"Berufsschullehrpersonen in der Schweiz arbeiten in einem stark regulierten Bildungssystem (BBG, BBV) mit hohem Anteil an praktischer, handwerklicher und sozialpädagogischer Arbeit, die schwer automatisierbar ist. KI kann Routineaufgaben wie Korrektur, Stoffvermittlung via E-Learning oder Fortschrittsdokumentation unterstützen, ersetzt jedoch nicht die individuelle Begleitung, Motivationsarbeit und Praxisvermittlung. Die enge Zusammenarbeit mit Lehrbetrieben und Berufsfachverbänden sowie die Brückenfunction zwischen Theorie und Praxis erfordern tiefe soziale und fachliche Kompetenz, die KI im betrachteten Zeitraum nicht substituieren kann.",-0.2,0.0,2.9,7.3
Posthalter/in / Logistiker/in Post,4415,15,42,Transport,68000,Sekundär II,http://data.europa.eu/esco/occupation/96430121-2757-4e96-9d6f-7517b25db4f7,Haussitter/Haussitterin,"Haussitter wohnen vorübergehend im Haus ihres Arbeitgebers, um die Sicherheit der Immobilie während dessen Abwesenheit zu wahren. Sie überwachen die Eingangsbereiche und verhindern, dass Unbefugte das Haus betreten. Sie inspizieren den Zustand des Gebäudes, z. B. die Rohrleitungen und die Heizungsanlage, und setzen sich bei Bedarf mit Reparaturbetrieben in Verbindung. Bisweilen übernehmen Haussitter auch Reinigungstätigkeiten, leiten Post weiter und bezahlen Rechnungen.",2.1,2.0,3.5,1.5,4.0,3.0,Teilautomatisierung administrativer Aufgaben wie Rechnungszahlung und Postweiterleitung durch digitale Tools; Überwachung durch smarte Sensoren und Kameras könnte einzelne Kontrollfunktionen ersetzen,>10 Jahre,"Haussitter-Tätigkeiten sind fundamental auf physische Präsenz, situatives Urteilsvermögen und Vertrauensverhältnisse angewiesen, was eine KI-Automatisierung im Kernbereich praktisch ausschliesst. Smart-Home-Technologien (wie sie in der Schweiz zunehmend verbreitet sind) können Überwachungsfunktionen ergänzen, ersetzen aber nicht die menschliche Reaktionsfähigkeit bei unvorhergesehenen Ereignissen wie Rohrbrüchen oder Einbruchsversuchen. Der Beruf bleibt wegen seiner ganzheitlichen Sicherheits- und Betreuungsfunktion stark von menschlicher Präsenz abhängig.",0.0,0.0,2.1,3.9
Apotheker/in,2262,14,72,Gesundheit,110000,Tertiär,http://data.europa.eu/esco/occupation/7c132147-428b-4ea3-87e1-70f7abb691ce,Apotheker/Apothekerin,"Apotheker/Apothekerinnen bereiten Arzneimittel zu, geben Arzneimittel ab und verkaufen frei erhältliche Arzneimittel. Sie bieten klinische Informationen über Arzneimittel, berichten über vermutete Nebenwirkungen und bieten Patientinnen/Patienten personalisierte Unterstützung. Apotheker/Apothekerinnen formulieren und testen Arzneimittel in Laboren, lagern sie, konservieren sie und geben sie ab.",5.6,7.0,7.5,4.0,5.5,3.5,"Automatisierte Medikamentenausgabe (Robotic Dispensing), KI-gestützte Arzneimittelinteraktionsprüfung, digitale Beratungsassistenten und automatisierte Rezeptverarbeitung könnten Routinetätigkeiten stark reduzieren.",3-5 Jahre,"In der Schweiz werden Robotic-Dispensing-Systeme wie in Spitalapotheken (z.B. Inselspital Bern) bereits eingesetzt und die Digitalisierung von Rezepten (E-Rezept) schreitet voran, was Routineaufgaben zunehmend automatisierbar macht. Die regulierte Berufslandschaft der Schweiz (Heilmittelgesetz, Kantonsapotheker) verlangsamt jedoch eine vollständige Automatisierung, da Apotheker/innen gesetzlich für die Abgabe und Beratung verantwortlich bleiben. Die stark ausgeprägte Beratungsrolle, das Vertrauensverhältnis zur Kundschaft und komplexe Fälle (Polypharmazie, individuelle Rezepturherstellung) sichern einen bedeutenden menschlichen Kernbereich.",-0.3,0.0,5.3,7.4
Bauingenieur/in,2142,14,18,Bau,115000,Tertiär,http://data.europa.eu/esco/occupation/d7d986e1-7333-431b-9719-0c5c6939e360,Bauingenieur/Bauingenieurin,,4.8,6.5,5.0,3.5,4.0,3.5,"Automatisierung von Strukturberechnungen, statischen Analysen, BIM-gestützter Planoptimierung, Kostenschätzungen und Normenprüfungen (z.B. SIA-Normen) durch KI-gestützte Engineering-Software",5-10 Jahre,"Bauingenieure in der Schweiz arbeiten zunehmend mit digitalen Tools wie BIM und CAD, wobei Routineberechnungen und Normprüfungen (SIA, Eurocode) bereits heute teilautomatisiert werden können. Jedoch erfordert der Beruf erhebliche physische Präsenz auf Baustellen, komplexe Problemlösung bei unvorhergesehenen Bauherausforderungen sowie intensive Koordination mit Behörden, Architekten und Auftraggebern. Die stark regulierte Schweizer Baubranche mit kantonalen Besonderheiten und hohen Sicherheitsanforderungen verlangsamt die vollständige KI-Durchdringung.",0.0,0.0,4.8,7.2
Zahnarzt/-ärztin,2261,12,48,Gesundheit,160000,Tertiär,http://data.europa.eu/esco/occupation/e52b5707-7097-4dbc-ac61-054e917da241,Zahnarzt/Zahnärztin,"Zahnärzte/Zahnärztinnen verhindern, diagnostizieren und behandeln Anomalien und Erkrankungen der Zähne, des Mundes, des Kiefers und der angrenzenden Gewebe.",3.2,5.0,4.5,1.5,4.0,3.0,"KI-gestützte Röntgen- und Bildanalyse (Karieserkennung, Parodontitis-Diagnose), automatisierte Behandlungsplanung sowie administrative Aufgaben wie Dokumentation und Abrechnung könnten teilautomatisiert werden.",5-10 Jahre,"Die manuelle, feinmotorische Behandlung am Patienten sowie die notwendige Vertrauensbeziehung schützen den Beruf stark vor vollständiger Automatisierung. In der Schweiz investieren Zahnarztpraxen zunehmend in digitale Technologien wie CAD/CAM-Systeme und KI-Diagnostik (z.B. Videomed, Dentem), was Teilprozesse effizienter macht, aber qualifizierte Zahnärzte nicht ersetzt. Die hohen Schweizer Regulierungsstandards (MedBG) und der Fachkräftemangel verlangsamen zudem disruptive Veränderungen im Berufsfeld.",-0.3,0.0,2.9000000000000004,8.1
Sicherheitsbeauftragter/-beauftragte,5414,12,15,Sicherheit,65000,Sekundär II,http://data.europa.eu/esco/occupation/c8ee6499-7613-4c02-9edf-2a0edcf47705,Sicherheitsbeauftragter Luftverkehr/Sicherheitsbeauftragte Luftverkehr,"Sicherheitsbeauftragte Luftverkehr planen und entwickeln Sicherheitsverfahren für Luftfahrtunternehmen. Sie kennen die für den Luftverkehr geltenden Sicherheitsvorschriften und Beschränkungen. Auf dieser Grundlage leiten sie das Personal an, um die vorschriftsgemäße Einhaltung der Sicherheitsmaßnahmen zu gewährleisten.",4.8,6.5,5.5,4.0,5.5,4.0,"Automatisierte Compliance-Prüfung von Sicherheitsvorschriften (BAZL/EASA-Regularien), KI-gestützte Risikoanalyse und Dokumentenmanagement sowie automatisierte Schulungsplanung und Audit-Protokollierung",5-10 Jahre,"Im Schweizer Luftverkehr (EuroAirport, Zürich, Genf) unterliegen Sicherheitsbeauftragte strengen BAZL- und EASA-Regularien, deren regelbasierte Compliance-Prüfung zunehmend durch KI-Systeme unterstützt werden kann. Jedoch erfordern Krisenmanagement, Personalführung und die Interpretation komplexer, situationsabhängiger Sicherheitsszenarien weiterhin menschliches Urteilsvermögen. Die hohe Verantwortung gegenüber Behörden und die notwendige physische Präsenz vor Ort bei Vorfällen schützen diesen Beruf mittelfristig vor vollständiger Automatisierung.",0.0,0.0,4.8,4.8
